{
  "$schema": "http://json-schema.org/draft-07/schema#",
  "$id": "https://example.invalid/taxwire-am-training/schema-v1",
  "title": "Taxwire AM portable training history (self-reported)",
  "type": "object",
  "additionalProperties": false,
  "required": [
    "format",
    "schemaVersion",
    "contentVersion",
    "exportedAt",
    "learner",
    "competencies",
    "missions",
    "artifacts",
    "reviewQueue",
    "extensions"
  ],
  "properties": {
    "format": {
      "const": "taxwire-am-training"
    },
    "schemaVersion": {
      "const": 1
    },
    "contentVersion": {
      "type": "string",
      "minLength": 1,
      "maxLength": 200
    },
    "exportedAt": {
      "type": "string",
      "maxLength": 40,
      "pattern": "^\\d{4}-\\d{2}-\\d{2}T\\d{2}:\\d{2}:\\d{2}(\\.\\d{1,3})?Z$"
    },
    "learner": {
      "type": "object",
      "additionalProperties": false,
      "required": [
        "id",
        "displayName"
      ],
      "properties": {
        "id": {
          "type": "string",
          "minLength": 1,
          "maxLength": 200
        },
        "displayName": {
          "type": "string",
          "minLength": 1,
          "maxLength": 100
        }
      }
    },
    "competencies": {
      "type": "array",
      "maxItems": 1000,
      "items": {
        "type": "object",
        "additionalProperties": false,
        "required": [
          "id",
          "level",
          "bestScore",
          "attemptCount",
          "evidenceMissionIds"
        ],
        "properties": {
          "id": {
            "type": "string",
            "minLength": 1,
            "maxLength": 200
          },
          "level": {
            "enum": [
              "not_started",
              "introduced",
              "practiced",
              "demonstrated"
            ]
          },
          "bestScore": {
            "type": "number",
            "minimum": 0,
            "maximum": 100
          },
          "attemptCount": {
            "type": "integer",
            "minimum": 0,
            "maximum": 100000
          },
          "evidenceMissionIds": {
            "type": "array",
            "maxItems": 1000,
            "uniqueItems": true,
            "items": {
              "type": "string",
              "minLength": 1,
              "maxLength": 200
            }
          }
        }
      }
    },
    "missions": {
      "type": "array",
      "maxItems": 1000,
      "items": {
        "type": "object",
        "additionalProperties": false,
        "required": [
          "id",
          "version",
          "status",
          "bestScore",
          "criticalFailures"
        ],
        "properties": {
          "id": {
            "type": "string",
            "minLength": 1,
            "maxLength": 200
          },
          "version": {
            "type": "integer",
            "minimum": 1,
            "maximum": 100000
          },
          "status": {
            "enum": [
              "not_started",
              "in_progress",
              "completed"
            ]
          },
          "bestScore": {
            "type": "number",
            "minimum": 0,
            "maximum": 100
          },
          "criticalFailures": {
            "type": "array",
            "maxItems": 1000,
            "uniqueItems": true,
            "items": {
              "type": "string",
              "minLength": 1,
              "maxLength": 200
            }
          }
        }
      }
    },
    "artifacts": {
      "type": "array",
      "maxItems": 2000,
      "items": {
        "type": "object",
        "additionalProperties": false,
        "required": [
          "id",
          "type",
          "missionId",
          "createdAt",
          "body"
        ],
        "properties": {
          "id": {
            "type": "string",
            "minLength": 1,
            "maxLength": 200
          },
          "type": {
            "type": "string",
            "minLength": 1,
            "maxLength": 200
          },
          "missionId": {
            "type": "string",
            "minLength": 1,
            "maxLength": 200
          },
          "createdAt": {
            "type": "string",
            "maxLength": 40,
            "pattern": "^\\d{4}-\\d{2}-\\d{2}T\\d{2}:\\d{2}:\\d{2}(\\.\\d{1,3})?Z$"
          },
          "body": {
            "type": "string",
            "maxLength": 16000
          }
        }
      }
    },
    "reviewQueue": {
      "type": "array",
      "maxItems": 1000,
      "items": {
        "type": "object",
        "additionalProperties": false,
        "required": [
          "competencyId",
          "dueAt",
          "reason"
        ],
        "properties": {
          "competencyId": {
            "type": "string",
            "minLength": 1,
            "maxLength": 200
          },
          "dueAt": {
            "type": "string",
            "maxLength": 40,
            "pattern": "^\\d{4}-\\d{2}-\\d{2}T\\d{2}:\\d{2}:\\d{2}(\\.\\d{1,3})?Z$"
          },
          "reason": {
            "type": "string",
            "maxLength": 16000
          }
        }
      }
    },
    "extensions": {
      "type": "object",
      "maxProperties": 200
    }
  }
}
